{"artifact_id":"report_platform_gate_inputs","catalog":{"path":"docs/reports/contracts/report-platform-gates.v1.json","sha256":"c46ada3e102efc60521f00c25471e23378739b031dfbf84891cb367e8baeaf96"},"gates":[{"artifact_sha256":"e1d643ede85d257dc189c6386eb9657685295cf0e70a00ea355dd74047d56480","command":"report-catalog-contract","commit_sha":"1111111111111111111111111111111111111111","count":28,"executed_at":"2026-07-26T00:00:00Z","gate":"QG-01","owner_plan":"backend","phase":"platform","release_sha":"1111111111111111111111111111111111111111","schema_sha256":"350197e5f6a60fbf81d5469302d2e72db23ebcf1b248d4932b1f3bc08ad2e5e1","source_artifacts":[{"path":"app/BusinessModules/Core/Reporting/resources/management-catalog.v1.yaml","sha256":"b6b44eac45e211acda9465c1d29f569403eddc1af9cf72d45c4da8f663263b07"},{"path":"app/BusinessModules/Core/Reporting/resources/management-catalog.v1.schema.json","sha256":"350197e5f6a60fbf81d5469302d2e72db23ebcf1b248d4932b1f3bc08ad2e5e1"},{"path":"app/BusinessModules/Core/Reporting/resources/official-document-catalog.v1.yaml","sha256":"db5918ade2bcb2b5c2c957d32e8ddc8ab8c9f6a13926ceed359b9ee16e00207e"}],"status":"passed"},{"artifact_sha256":null,"command":"golden-fixtures","commit_sha":"1111111111111111111111111111111111111111","count":56,"executed_at":"2026-07-26T00:00:00Z","gate":"QG-02","owner_plan":"backend","phase":"platform","release_sha":"1111111111111111111111111111111111111111","schema_sha256":"4bf45c7093d4027fa20b2c959cd2fab809c7808efe49b0adb95fb3891464c657","source_artifacts":[],"status":"pending"},{"artifact_sha256":null,"command":"property-seeds","commit_sha":"1111111111111111111111111111111111111111","count":500,"executed_at":"2026-07-26T00:00:00Z","gate":"QG-03","owner_plan":"backend","phase":"platform","release_sha":"1111111111111111111111111111111111111111","schema_sha256":"4bf45c7093d4027fa20b2c959cd2fab809c7808efe49b0adb95fb3891464c657","source_artifacts":[],"status":"pending"},{"artifact_sha256":"b7623864512dd132973b9cc91a6cbd82c1555c5d2a46b9410b4625725735d325","command":"conformance-harness","commit_sha":"1111111111111111111111111111111111111111","count":28,"executed_at":"2026-07-26T00:00:00Z","gate":"QG-04","owner_plan":"backend","phase":"platform","release_sha":"1111111111111111111111111111111111111111","schema_sha256":"4bf45c7093d4027fa20b2c959cd2fab809c7808efe49b0adb95fb3891464c657","source_artifacts":[{"path":"tests/Fixtures/Reporting/Manifest/management.valid.yaml","sha256":"6bbc8044b43257f96fd868c980ace0ecc6a4cf881795ee1c459163bfc414552c"},{"path":"docs/reports/contracts/report-conformance-evidence.schema.json","sha256":"4bf45c7093d4027fa20b2c959cd2fab809c7808efe49b0adb95fb3891464c657"},{"path":"tests/Architecture/Reporting/ReportConformanceEvidenceSchemaTest.php","sha256":"05b4128e1ec15372ccf83ff031271bf47bf5efe954ec1a08ee071ff7dd411db4"}],"status":"passed"},{"artifact_sha256":"d0a063ddca9f0377605a98bd661f3f51eb12d46090562926e13a5e528cf432e0","command":"workspace-isolation","commit_sha":"1111111111111111111111111111111111111111","count":1,"executed_at":"2026-07-26T00:00:00Z","gate":"QG-05","owner_plan":"backend","phase":"platform","release_sha":"1111111111111111111111111111111111111111","schema_sha256":"437f80ebb16a84adf7389adb504be0395ad5cc398eeadaf0d70ba2f1b6e9ee4e","source_artifacts":[{"path":"docs/reports/contracts/reporting-admin-resources.v1.schema.json","sha256":"437f80ebb16a84adf7389adb504be0395ad5cc398eeadaf0d70ba2f1b6e9ee4e"},{"path":"tests/Architecture/Reporting/CandidatePublishedBoundaryTest.php","sha256":"3615fcfe76a8d4a97421718a88087a5765b08aa1ba81af615cac2793267160f1"},{"path":"tests/Architecture/Reporting/ReportWorkspaceRouteContractTest.php","sha256":"31fdeb81cf34fea683865953c6f507533af4cac7582bda185bdf4c3947787cb2"}],"status":"passed"},{"artifact_sha256":"aaf3e322d9f0a667b3930f57aab13582c9c7f84a1111ce14f111c804727ac557","command":"http-contract","commit_sha":"1111111111111111111111111111111111111111","count":46,"executed_at":"2026-07-26T00:00:00Z","gate":"QG-06","owner_plan":"backend","phase":"platform","release_sha":"1111111111111111111111111111111111111111","schema_sha256":"903b64ed06afdc024f4fdbd6ed6d694dee53116d3ca6ba9e9140beb1eda052e8","source_artifacts":[{"path":"docs/reports/contracts/plan-1a-gate-evidence.schema.json","sha256":"903b64ed06afdc024f4fdbd6ed6d694dee53116d3ca6ba9e9140beb1eda052e8"},{"path":"docs/reports/contracts/reporting-admin-resources.v1.schema.json","sha256":"437f80ebb16a84adf7389adb504be0395ad5cc398eeadaf0d70ba2f1b6e9ee4e"},{"path":"tests/Architecture/Reporting/PlanOneAHandoffContractTest.php","sha256":"86b031b2c458ca1da15af7b3ee57e5d395bd5f5eb30a4209a01aee8133959972"}],"status":"passed"},{"artifact_sha256":null,"command":"performance-evidence","commit_sha":"1111111111111111111111111111111111111111","count":28,"executed_at":"2026-07-26T00:00:00Z","gate":"QG-07","owner_plan":"backend","phase":"platform","release_sha":"1111111111111111111111111111111111111111","schema_sha256":"4bf45c7093d4027fa20b2c959cd2fab809c7808efe49b0adb95fb3891464c657","source_artifacts":[],"status":"pending"},{"artifact_sha256":null,"command":"export-parity","commit_sha":"1111111111111111111111111111111111111111","count":28,"executed_at":"2026-07-26T00:00:00Z","gate":"QG-08","owner_plan":"backend","phase":"platform","release_sha":"1111111111111111111111111111111111111111","schema_sha256":"2a895369b6175146980a02b6f66192800de95487f78c7038dc6cda26bc149049","source_artifacts":[],"status":"pending"},{"artifact_sha256":"53b2730566b5374e9820847249f10e6530de1357f28f9c7ac0b2d7310359a127","command":"scoped-static-analysis","commit_sha":"1111111111111111111111111111111111111111","count":1,"executed_at":"2026-07-26T00:00:00Z","gate":"QG-09","owner_plan":"backend","phase":"platform","release_sha":"1111111111111111111111111111111111111111","schema_sha256":"2a895369b6175146980a02b6f66192800de95487f78c7038dc6cda26bc149049","source_artifacts":[{"path":"docs/reports/contracts/plan-1b-evidence.schema.json","sha256":"2a895369b6175146980a02b6f66192800de95487f78c7038dc6cda26bc149049"},{"path":"tests/Architecture/Reporting/PlanOneBCrossFileSymbolTest.php","sha256":"3aa7bf2f9ddc76f2fa7f8a663d2c05f9f67f2e31db05c04f7955a76f1ca21748"}],"status":"passed"},{"artifact_sha256":null,"command":"typed-admin-definitions","commit_sha":"1111111111111111111111111111111111111111","count":28,"executed_at":"2026-07-26T00:00:00Z","gate":"QG-10","owner_plan":"admin","phase":"platform","release_sha":"1111111111111111111111111111111111111111","schema_sha256":"437f80ebb16a84adf7389adb504be0395ad5cc398eeadaf0d70ba2f1b6e9ee4e","source_artifacts":[],"status":"pending"},{"artifact_sha256":null,"command":"admin-states","commit_sha":"1111111111111111111111111111111111111111","count":252,"executed_at":"2026-07-26T00:00:00Z","gate":"QG-11","owner_plan":"admin","phase":"platform","release_sha":"1111111111111111111111111111111111111111","schema_sha256":"437f80ebb16a84adf7389adb504be0395ad5cc398eeadaf0d70ba2f1b6e9ee4e","source_artifacts":[],"status":"pending"},{"artifact_sha256":null,"command":"admin-accessibility","commit_sha":"1111111111111111111111111111111111111111","count":25,"executed_at":"2026-07-26T00:00:00Z","gate":"QG-12","owner_plan":"admin","phase":"platform","release_sha":"1111111111111111111111111111111111111111","schema_sha256":"437f80ebb16a84adf7389adb504be0395ad5cc398eeadaf0d70ba2f1b6e9ee4e","source_artifacts":[],"status":"pending"},{"artifact_sha256":null,"command":"admin-static-analysis","commit_sha":"1111111111111111111111111111111111111111","count":3,"executed_at":"2026-07-26T00:00:00Z","gate":"QG-13","owner_plan":"admin","phase":"platform","release_sha":"1111111111111111111111111111111111111111","schema_sha256":"437f80ebb16a84adf7389adb504be0395ad5cc398eeadaf0d70ba2f1b6e9ee4e","source_artifacts":[],"status":"pending"},{"artifact_sha256":null,"command":"qg14_forbidden_symbols","commit_sha":"1111111111111111111111111111111111111111","count":0,"executed_at":"2026-07-26T00:00:00Z","gate":"QG-14","owner_plan":"both","phase":"platform","release_sha":"1111111111111111111111111111111111111111","schema_sha256":"437f80ebb16a84adf7389adb504be0395ad5cc398eeadaf0d70ba2f1b6e9ee4e","source_artifacts":[],"status":"pending"}],"generated_at":"2026-07-26T00:00:00Z","release_sha":"1111111111111111111111111111111111111111","schema_version":"1.0.0","status":"platform_gate_inputs_passed"}
